{
  "schemaVersion": 1,
  "dataVersion": 3,
  "minimumEngineVersion": "1.1.0",
  "publishedAt": "2026-10-21T13:24:01Z",
  "files": [
    "conference.json",
    "programme.json",
    "people.json",
    "locations.json",
    "branding.json"
  ],
  "checksums": {
    "conference.json": "9f748b437d6cb78011c20820624f3b6526df78a63faf6e9586c7111339c211f2",
    "programme.json": "ac9d9c9cbfef89437d752f0f939f505950c10da001f57e3b79ebf12019133ef1",
    "people.json": "d868a1979ed5993c97692d7bdb8750d0eb1d3543d661505dcd5dd478ae1e1988",
    "locations.json": "113263a33a0bb1c6edd793246d9f3f40441b410e7e7c4ca2dbf3310d4fcf27d8",
    "branding.json": "f64986e9879d15d41d0fe8d5b75fd3288b2a7609d45ffec994f6684d354a4b76"
  },
  "changelog": [
    {
      "version": 2,
      "publishedAt": "2026-10-21T12:00:00Z",
      "message": "Conference Companion 1.0 package: calendar IDs, local-first Friend Book and calendar features enabled."
    },
    {
      "version": 3,
      "publishedAt": "2026-10-21T13:24:01Z",
      "message": "Aligned generic development package with the Conference Companion 1.1 calendar UID and runtime-validation contract."
    }
  ]
}
