{
  "schemaVersion": 1,
  "dataVersion": 1,
  "minimumEngineVersion": "1.1.5",
  "publishedAt": "2026-10-23T08:00:00Z",
  "files": [
    "conference.json",
    "programme.json",
    "people.json",
    "locations.json",
    "branding.json"
  ],
  "checksums": {
    "conference.json": "d85a8c6202a544f780ba306d8e800036f9af0df1aa0a6f2047f3e5e87aa18128",
    "programme.json": "04450d2a460766f24b104f7a0aa4b860c01553b5284e74884fe6d373640fb78c",
    "people.json": "d868a1979ed5993c97692d7bdb8750d0eb1d3543d661505dcd5dd478ae1e1988",
    "locations.json": "113263a33a0bb1c6edd793246d9f3f40441b410e7e7c4ca2dbf3310d4fcf27d8",
    "branding.json": "f64986e9879d15d41d0fe8d5b75fd3288b2a7609d45ffec994f6684d354a4b76"
  },
  "changelog": [
    {
      "version": 1,
      "publishedAt": "2026-10-23T08:00:00Z",
      "message": "Synthetic multi-poster-session regression fixture."
    }
  ]
}
